{
  "credential": {
    "credential_id": "xlnodecred:blake3:c94fe9ad1621454c06fc70f3779479fc04ece86ec3bcf9d0d27f8996e1f2b95e",
    "credential_kind": "node"
  },
  "effective_at": "2026-10-01T00:00:00Z",
  "evidence_root": "blake3:example-revocation-evidence-root",
  "issuer": "did:web:issuer.xlemma.example",
  "issuer_signature": "example-revocation-issuer-signature",
  "reason_code": "operator_requested_key_rotation",
  "revocation_id": "xlrevocation:blake3:e24702c5ab3447e1908b4e96bff1764314adeae7bd004deab3e8ecff4073cb8f"
}
